<?xml version="1.0"?>
<!DOCTYPE LearningObject SYSTEM "\\Salomon\kain\ILIAS_OS\Dokumentation ILIAS\XML\ILIAS DTD\Test\ilias_lo.dtd">
<LearningObject><MetaData><General AggregationLevel="2" Structure="Collection"><Identifier Catalog="ILIAS" Entry="A-1-2"/><Title Language="de"><Strong>Testdokument	- Teil 2</Strong></Title><Language>Deutsch</Language><Description Language="de">Testdokument zum <Emph>Überprüfen</Emph> des LO-Imports in ILIAS</Description><Keyword Language="de">Test,Import, ILIAS</Keyword><Coverage Language="de">Hochschule</Coverage></General><Lifecycle Status="Draft"><Version Language="de">1.0</Version><Contribute Role="Author"><Entity>Matthias Kunkel</Entity><Entity>keine Ahnung</Entity><Date>2002-11-25</Date></Contribute></Lifecycle><Meta-Metadata><Identifier Catalog="ILIAS" Entry="ILIAS123"/><Contribute Role="Author"><Entity>noch was zum Eintragen</Entity><Date>2002-10-20</Date></Contribute></Meta-Metadata><Technical Format="text-plain"><Requirement><Type><Browser Name="NetscapeCommunicator" MinimumVersion="3.0"/></Type></Requirement></Technical><Educational InteractivityType="Mixed" LearningResourceType="NarrativeText" InteractivityLevel="Medium" SemanticDensity="Low" IntendedEndUserRole="Learner" Context="Training" Difficulty="Easy"><TypicalAgeRange Language="de">18-65</TypicalAgeRange><TypicalLearningTime>1 Stunde</TypicalLearningTime><Language>Deutsch</Language></Educational><Classification Purpose="EducationalLevel"><TaxonPath><Source Language="de">ISBN</Source><Taxon><Entry>123.234.345</Entry></Taxon></TaxonPath><Description Language="de">Irgendwas</Description><Keyword Language="de">Sonstwo</Keyword></Classification></MetaData><Content><Text><Headline Language="de">Über ILIAS</Headline><Paragraph Language="de">Die Online-Lernplattform ILIAS (Integriertes Lern-, Informations- und ArbeitskooperationsSystem) steht als open source Software unter der General Public Licence (GPL) zur Verfügung. Damit können Hochschulen, Bildungseinrichtungen und andere Interessenten das System kostenlos nutzen und nach eigenen Vorstellungen weiterentwickeln.</Paragraph><Paragraph Language="de">

ILIAS wurde im Rahmen des VIRTUS-Projekts an der Wirtschafts- und Sozialwissenschaftlichen Fakultät der Universität zu Köln entwickelt. Mittels einer Client-Server-System ermöglicht ILIAS das Erstellen, Bearbeiten und Darstellen von Lehrmaterialien in einer einheitlichen Umgebung.

</Paragraph><Paragraph Language="de">Zu den umfangreichen Features von ILIAS gehören:<List Type="Unordered"><Item><Paragraph Language="de">Persönlicher Schreibtisch</Paragraph></Item><Item><Paragraph Language="de">Lernumgebung</Paragraph></Item><Item><Paragraph Language="de">Arbeitsumgebung</Paragraph></Item><Item><Paragraph Language="de">Kommunikationstools</Paragraph></Item></List><List Type="Unordered"><Item><Paragraph Language="de">Gruppen- und Rechtesystem</Paragraph></Item></List></Paragraph></Text><Text><Paragraph Language="de">Auf diesen Seiten hier erhalten Sie die neuesten Versionen, Module und Informationen. Das aktuelle Release können Sie sich auf der <Link Href="http://www.ilias.uni-koeln.de/source.html" Title="Sourcecode">source-Seite</Link> herunterladen. Unter info finden Sie wichtige Informationen und Neuigkeiten. Und auf der <Link Href="http://www.ilias.uni-koeln.de/docs.html" Title="Dokumente">docs-Seite</Link> werden wir alle Dokumentationen zu ILIAS bereitstellen. Einen ersten Eindruck von ILIAS bekommen Sie in unserem <Link Href="http://www.ilias.uni-koeln.de/demo" Title="Demo-Installation">demo-System</Link>. An der Uni Köln koordiniert ein Team die Softwareentwicklung und ist zugleich Ansprechpartner für alle externen Entwickler. </Paragraph></Text><LearningObject><MetaData><General Structure="Atomic" AggregationLevel="1"><Identifier Catalog="ILIAS" Entry="A-1-1-1"/><Title Language="de">CampusSource</Title><Language>de</Language><Description Language="de">CampusSource Logo</Description><Keyword Language="de">CampusSource</Keyword></General><Technical Format="image-gif"><Location>http://www.ilias.uni-koeln.de/ios/lgs/ilias.gif</Location><Requirement><Type><Browser Name="Any" MinimumVersion="3.0"/></Type></Requirement><Duration>1"</Duration></Technical></MetaData><Layout KeepWithNext="Yes" KeepWithPrevious="No"/></LearningObject><Text><Paragraph Language="de">ILIAS ist Teil der NRW-Initiative CampusSource und steht nach abgeschlossener Zertifizierung auch in der Softwarebörse von CampusSource zum Download zur Verfügung.
</Paragraph></Text></Content><Bibliography>Kunkel, Matthias: Erste Schritte mit ILIAS; 22. Auflage, Köln, 2002</Bibliography></LearningObject>
